{
  "format": "liveglow-cheer",
  "version": 1,
  "song": { "title": "合成曲目", "artist": "合成组合", "duration": 7200, "appleMusicID": "12345678901234567890" },
  "members": [
    { "id": "AAAAAAAAAAAAAAAA_-0123456789abcd", "name": "名名名名名名名名名名名名名名名名名名名名名名名名名名名名名名名名", "color": "#abcdef" }
  ],
  "events": [
    { "start": 0, "end": 7205, "kind": "part", "members": ["AAAAAAAAAAAAAAAA_-0123456789abcd"] },
    {
      "start": 100,
      "end": 100.05,
      "kind": "call",
      "text": "喊喊喊喊喊喊喊喊喊喊喊喊喊喊喊喊喊喊喊喊喊喊喊喊喊喊喊喊喊喊喊喊喊喊喊喊喊喊喊喊喊喊喊喊喊喊喊喊喊喊喊喊喊喊喊喊喊喊喊！"
    },
    {
      "start": 7000,
      "end": 7010,
      "kind": "mix",
      "text": "!!!!!!!!!!!!!!!!!!!!!!!!!!!!!!!!!!!!!!!!!!!!!!!!!!!!!!!!!!!!!!!!",
      "steps": [0, 0.15, 0.3, 0.44999999999999996, 0.6, 0.75, 0.8999999999999999, 1.05, 1.2, 1.3499999999999999, 1.5, 1.65, 1.7999999999999998, 1.95, 2.1, 2.25, 2.4, 2.55, 2.6999999999999997, 2.85, 3, 3.15, 3.3, 3.4499999999999997, 3.5999999999999996, 3.75, 3.9, 4.05, 4.2, 4.35, 4.5, 4.6499999999999995, 4.8, 4.95, 5.1, 5.25, 5.3999999999999995, 5.55, 5.7, 5.85, 6, 6.1499999999999995, 6.3, 6.45, 6.6, 6.75, 6.8999999999999995, 7.05, 7.199999999999999, 7.35, 7.5, 7.6499999999999995, 7.8, 7.949999999999999, 8.1, 8.25, 8.4, 8.549999999999999, 8.7, 8.85, 9, 9.15, 9.299999999999999, 9.45],
      "name": "名名名名名名名名名名名名名名名名名名名名名名名名名名名名名名名名"
    },
    {
      "start": 200,
      "end": 210,
      "kind": "mix",
      "text": "喊喊喊喊喊喊喊喊喊喊喊喊喊喊喊喊喊喊喊喊喊喊喊喊喊喊喊喊喊喊喊喊喊喊喊喊喊喊喊喊喊喊喊喊喊喊喊喊喊喊喊喊喊喊喊喊喊喊喊喊喊喊喊喊喊喊喊喊喊喊喊喊喊喊喊喊喊喊喊喊喊喊喊喊喊喊喊喊喊喊喊喊喊喊喊喊喊喊喊喊喊喊喊喊喊喊喊喊喊喊喊喊喊喊喊喊喊喊喊！"
    },
    { "start": 300, "end": 301, "kind": "note", "text": "提提提提提提提提提提提提提提提提提提提提提提提提提提提提提提提提提提提提提提提提提提提提提提提提提提提提提提提提提提提提" }
  ],
  "credits": {
    "authors": [{ "name": "作作作作作作作作作作作作作作作作作作作作作作作作作作作作作作作作作作作作作作作作作作作作作作作作作作作作作作作作作作作作作作作作" }],
    "sources": [
      {
        "kind": "self",
        "title": "源源源源源源源源源源源源源源源源源源源源源源源源源源源源源源源源源源源源源源源源源源源源源源源源源源源源源源源源源源源源源源源源源源源源源源源源源源源源源源源源源源源源源源源源源源源源源源源源源源源源源源源源源源源源源源源源源源源源源源源源"
      }
    ],
    "permission": "original",
    "note": "注注注注注注注注注注注注注注注注注注注注注注注注注注注注注注注注注注注注注注注注注注注注注注注注注注注注注注注注注注注注注注注注注注注注注注注注注注注注注注注注注注注注注注注注注注注注注注注注注注注注注注注注注注注注注注注注注注注注注注注注注注注注注注注注注注注注注注注注注注注注注注注注注注注注注注注注注注注注注注注注注注注注注注注注注注注注注注注注注注注注注注注注注注注注注注注注注注注注注注注注"
  },
  "offset": -10,
  "generator": "gggggggggggggggggggggggggggggggggggggggggggggggggggggggggggggggg"
}
