{
  "format": "liveglow-cheer",
  "version": 1,
  "song": { "title": "合成曲目", "artist": "合成组合", "duration": 180 },
  "members": [{ "id": "a", "name": "成员甲", "color": "#E4007F" }, { "id": "b", "name": "成员乙", "color": "#00A0E9" }],
  "events": [
    { "start": 10, "end": 20, "kind": "part", "members": ["a"] },
    { "start": 20, "end": 24, "kind": "mix", "text": "合成！口号！", "members": ["a"] },
    { "start": 30, "end": 31, "kind": "call", "text": "e\u0301e\u0301e\u0301e\u0301e\u0301e\u0301e\u0301e\u0301e\u0301e\u0301e\u0301e\u0301e\u0301e\u0301e\u0301e\u0301e\u0301e\u0301e\u0301e\u0301e\u0301e\u0301e\u0301e\u0301e\u0301e\u0301e\u0301e\u0301e\u0301嘿！" },
    { "start": 40, "end": 42, "kind": "call", "echo": true },
    { "start": 50, "end": 51, "kind": "note", "text": "举灯" }
  ],
  "credits": { "authors": [{ "name": "合成作者" }], "sources": [{ "kind": "self" }], "permission": "original" }
}
